{
  "schema": "usl-engineering-review/v1",
  "reviewedAt": "2026-09-22",
  "authority": "SECONDARY_AI",
  "upstreamExecution": "NOT_TESTED",
  "controls": [
    {
      "id": "C01",
      "title": "역할 도메인 타입과 필수 역할",
      "scope": "명시한 type IRI와 역할만 검사한다.",
      "implementation": [
        "src/domain-profile.ts",
        "src/integrations/resource-graph.ts"
      ],
      "checks": [
        "role-type",
        "roles-and-unknown-meaning",
        "profile-invalid-json"
      ],
      "residual": "원본의 타입 선언 자체가 현실에서 참인지는 검증하지 않는다."
    },
    {
      "id": "C02",
      "title": "단위·revision 맥락",
      "scope": "profile metadata와 호출 input unit의 정확한 일치를 검사한다.",
      "implementation": [
        "src/domain-profile.ts",
        "src/capabilities.ts"
      ],
      "checks": [
        "unit-and-revision",
        "input-unit"
      ],
      "residual": "단위 변환·좌표 변환·교정·수치 해석은 제공하지 않는다."
    },
    {
      "id": "C03",
      "title": "호스트 권한과 효과 경계",
      "scope": "소유자 binding·scope·effect를 확인하고 등록 시 snapshot을 고정한다.",
      "implementation": [
        "src/capabilities.ts",
        "src/capability-catalog.ts",
        "src/json-data.ts",
        "src/contract-core.ts",
        "src/application.ts",
        "src/mcp.ts",
        "src/mcp-config.ts",
        "src/cli-capabilities.ts"
      ],
      "checks": [
        "authority",
        "immutable-owner-policy",
        "host-catalog-preflight"
      ],
      "residual": "호스트의 거짓 선언이나 외부 서비스가 허용 범위를 어기는 행동까지 차단하는 sandbox는 아니다."
    },
    {
      "id": "C04",
      "title": "JSON Schema와 입력 예산",
      "scope": "제한된 JSON Schema 2020-12 입력/출력을 Ajv strict mode로 검사한다.",
      "implementation": [
        "src/capabilities.ts",
        "src/contract-core.ts"
      ],
      "checks": [
        "schema-and-budget",
        "unsupported-schema"
      ],
      "residual": "ref·regex·format 등 지원하지 않는 keyword는 거부한다. 전체 JSON Schema 지원이 아니다."
    },
    {
      "id": "C05",
      "title": "계약과 근거 pin",
      "scope": "descriptor/source/profile 변경을 별개 digest로 검사한다.",
      "implementation": [
        "src/capabilities.ts",
        "src/domain-profile.ts",
        "src/integrations/resource-graph.ts"
      ],
      "checks": [
        "stale-pins",
        "profile-drift"
      ],
      "residual": "외부 최신 상태의 원자적 확인은 expectedSourceDigest를 받은 소유자 실행기의 책임이다."
    },
    {
      "id": "C06",
      "title": "변환 손실과 지원 범위",
      "scope": "부분·미지원 매핑은 호출을 거부하고 알려진 손실은 owner의 명시적 수용을 요구한다.",
      "implementation": [
        "src/capabilities.ts"
      ],
      "checks": [
        "mapping-loss"
      ],
      "residual": "매핑 보고의 완전성과 변환 의미 보존 자체를 자동 증명하지 않는다."
    },
    {
      "id": "C07",
      "title": "예산 있는 기능 발견",
      "scope": "공급된 목록 안에서 의미·입력 타입을 조회하고 불완전 범위를 표시한다.",
      "implementation": [
        "src/capabilities.ts",
        "src/capability-catalog.ts"
      ],
      "checks": [
        "bounded-discovery",
        "catalog-discovery-scope"
      ],
      "residual": "자연어 의미 추론·전체 인터넷 검색·전역적 기능 발견을 수행하지 않는다."
    },
    {
      "id": "C08",
      "title": "실행 시도와 불명확한 결과",
      "scope": "효과 후 오류·시간 초과·응답 계약 위반을 INDETERMINATE로 남기고 자동 재시도하지 않는다.",
      "implementation": [
        "src/capabilities.ts"
      ],
      "checks": [
        "executor-outcome",
        "timeout",
        "unsupported-subscribe"
      ],
      "residual": "분산 transaction·정확히 한 번 실행·강제 취소·durable reconciliation·stream 구독은 제공하지 않는다."
    },
    {
      "id": "C09",
      "title": "명세 수입과 비신뢰 설명",
      "scope": "MCP tool list/OpenAPI 3.1 문서를 순수 변환하고 외부 참조를 따라가지 않는다.",
      "implementation": [
        "src/integrations/capability-inventory.ts",
        "src/capabilities.ts"
      ],
      "checks": [
        "mcp-annotations",
        "inventory-gaps",
        "inventory-positive"
      ],
      "residual": "MCP tools/list 입력과 OpenAPI의 제한된 JSON operation subset이며 서비스 인증·전송 driver는 별도다."
    },
    {
      "id": "C10",
      "title": "선언·검사·의미의 참 구분",
      "scope": "연결·검사·실행 보고가 semantic truth나 원본 제품의 결함 판정으로 승격되지 않게 한다.",
      "implementation": [
        "src/capabilities.ts",
        "src/engineering-review.ts",
        "src/language/navigation.ts"
      ],
      "checks": [
        "declaration-not-truth",
        "receipt-evidence-gate"
      ],
      "residual": "도메인 주장의 참과 물리적 적합성은 별도 증거와 검증기가 필요하다."
    },
    {
      "id": "C11",
      "title": "native ID와 역할 보존",
      "scope": "응답/connection 범위에서 ID 충돌과 중복 역할을 거부한다.",
      "implementation": [
        "src/integrations/resource-graph.ts",
        "src/capabilities.ts"
      ],
      "checks": [
        "identity-and-roles"
      ],
      "residual": "시스템 사이의 실체 동일성·장기간 symbol 동일성은 자동 판정하지 않는다."
    },
    {
      "id": "C12",
      "title": "다자 관계의 표준 교환",
      "scope": "명명된 역할·출처·선언 상태와 profile 참조를 JSON-LD/RDF로 내보낸다.",
      "implementation": [
        "src/integrations/resource-graph.ts",
        "schemas/resource-graph.shacl.ttl"
      ],
      "checks": [
        "nary-and-standard-export"
      ],
      "residual": "지원하는 USL 출력에 한정하며 임의 RDF 역수입·모든 외부 형식의 무손실 왕복은 미지원이다."
    }
  ],
  "technologies": [
    {
      "id": "S01",
      "title": "OSLC Core 3.0",
      "sources": [
        "https://docs.oasis-open-projects.org/oslc-op/core/v3.0/os/oslc-core.html"
      ],
      "upstreamCapability": "공학 도구 자원의 연합 연결, capability 발견, resource shape",
      "classification": "SCOPE_BOUNDARY",
      "limitation": "도구 간 연결·shape만으로 코드가 요구사항을 만족함이 확정되지 않는다.",
      "requirement": "요구사항/구현/실행 근거의 역할을 검사하고 검증 범위를 유지한다.",
      "attack": "시험 결과 타입의 자원을 코드 역할에 연결하고 OSLC 연결이 있으므로 구현 검증 완료라고 해석한다.",
      "expected": "타입 불일치를 거부하고 의미의 참은 미평가로 유지한다.",
      "controls": [
        "C01",
        "C10"
      ],
      "residual": "OSLC endpoint discovery와 lifecycle domain API driver는 아직 구현하지 않았다."
    },
    {
      "id": "S02",
      "title": "WoT TD 1.1",
      "sources": [
        "https://www.w3.org/TR/wot-thing-description11/"
      ],
      "upstreamCapability": "상호작용 affordance, 데이터 스키마, 접근 forms와 보안 기술",
      "classification": "SCOPE_BOUNDARY",
      "limitation": "기능 기술과 protocol form이 올바른 단위·호출 권한을 자동 보장하지 않는다.",
      "requirement": "의미 타입·단위·호스트 허용 effect를 함께 검사한다.",
      "attack": "섭씨 입력에 초 단위 값을 넣거나 action 설명만으로 WRITE를 요청한다.",
      "expected": "단위 불일치 또는 effect 권한 위반을 IO 전에 거부한다.",
      "controls": [
        "C02",
        "C03"
      ],
      "residual": "WoT protocol binding 및 실제 장치의 상호작용 구현은 별도다."
    },
    {
      "id": "S03",
      "title": "MCP 2025-11-25, tools",
      "sources": [
        "https://modelcontextprotocol.io/specification/2025-11-25",
        "https://modelcontextprotocol.io/specification/2025-11-25/server/tools"
      ],
      "upstreamCapability": "AI 앱이 도구·자원 등에 접근하는 프로토콜과 구조화된 도구 계약",
      "classification": "INTEGRATION_HAZARD",
      "limitation": "도구 annotation은 신뢰 근거 없이 무해성·인가로 사용할 수 없다.",
      "requirement": "명세의 힌트와 호스트 권한을 분리하고 input schema를 검사한다.",
      "attack": "삭제 도구가 readOnlyHint=true 및 정책을 무시하라는 설명을 제시한다.",
      "expected": "import 결과 effect는 UNKNOWN이며 임의 scope를 얻지 못한다.",
      "controls": [
        "C03",
        "C04",
        "C09"
      ],
      "residual": "모든 MCP feature·인증·전송을 대체하지 않는다."
    },
    {
      "id": "S04",
      "title": "A2A v0.3.0",
      "sources": [
        "https://a2a-protocol.org/v0.3.0/specification/"
      ],
      "upstreamCapability": "Agent Card, skill, task, message, artifact를 통한 에이전트 상호운용",
      "classification": "SCOPE_BOUNDARY",
      "limitation": "task 성공과 artifact 수신만으로 작업 내용의 도메인 진실성이 입증되지 않는다.",
      "requirement": "수행 상태와 산출물 schema 검사 및 의미 판정을 구분한다.",
      "attack": "작업은 성공이라고 하지만 output의 타입이 다르거나 결과 회신이 끊긴다.",
      "expected": "잘못된 결과와 timeout을 불명 상태로 남기고 의미의 참을 확정하지 않는다.",
      "controls": [
        "C04",
        "C08",
        "C10"
      ],
      "residual": "A2A 서버·task 상태 동기화·메시지 전송은 미구현이다."
    },
    {
      "id": "S05",
      "title": "LinkML, slots",
      "sources": [
        "https://linkml.io/linkml/generators/",
        "https://linkml.io/linkml/schemas/slots.html"
      ],
      "upstreamCapability": "의미 모델, slot 제약, JSON Schema·RDF·SHACL·언어별 생성기",
      "classification": "SCOPE_BOUNDARY",
      "limitation": "생성 대상별 표현력 차이로 모든 제약이 모든 형식에 보존되지는 않는다.",
      "requirement": "손실·미지원 규칙을 매핑 계약에 기록한다.",
      "attack": "생성 중 역할 제약을 버리고 손실 보고를 포함한 descriptor를 호출한다.",
      "expected": "소유자가 손실을 수용하지 않으면 거부하고 미지원은 항상 거부한다.",
      "controls": [
        "C06",
        "C12"
      ],
      "residual": "LinkML generator별 제약 보존 검증 및 generator 연결은 별도다."
    },
    {
      "id": "S06",
      "title": "Palantir Ontology",
      "sources": [
        "https://www.palantir.com/docs/foundry/object-link-types/type-reference"
      ],
      "upstreamCapability": "업무 객체·관계·행동·인터페이스를 모델링",
      "classification": "SCOPE_BOUNDARY",
      "limitation": "업무 객체·행동 모델을 다른 시스템으로 옮길 때 권한·ID·행동 의미를 따로 연결해야 한다.",
      "requirement": "native ID를 보존하고 action의 호스트 권한을 별도로 확인한다.",
      "attack": "다른 connection의 같은 객체 이름과 action을 동일 권한으로 실행한다.",
      "expected": "connection binding 불일치를 거부한다.",
      "controls": [
        "C03",
        "C11"
      ],
      "residual": "Palantir 플랫폼의 데이터·운영·보안 기능 전체를 구현한 것이 아니다."
    },
    {
      "id": "S07",
      "title": "Composio, 인증",
      "sources": [
        "https://docs.composio.dev/",
        "https://docs.composio.dev/docs/authentication"
      ],
      "upstreamCapability": "도구 발견, 사용자 연결·인증, 앱의 action 실행",
      "classification": "SCOPE_BOUNDARY",
      "limitation": "앱 도구와 인증이 존재해도 서로 다른 도구의 업무 의미·효과가 호환된다는 뜻은 아니다.",
      "requirement": "binding 범위와 명시적 meaning을 갖춘 기능만 호출한다.",
      "attack": "이름이 같은 다른 계정 도구를 검색 결과만으로 실행한다.",
      "expected": "발견은 인가하지 않으며 잘못된 binding을 거부한다.",
      "controls": [
        "C03",
        "C07"
      ],
      "residual": "Composio의 실제 계정 인증·credential 관리와 앱 커넥터는 외부 소유다."
    },
    {
      "id": "S08",
      "title": "Airbyte Agents, 기존 커넥터 모델",
      "sources": [
        "https://docs.airbyte.com/ai-agents/",